{
  "schema_version": "account-delivery-receipt.v1",
  "evidence_scope": "synthetic-contract-fixture",
  "service": "beacon-account",
  "target": "staging",
  "operation": "interruption-checkpoint",
  "outcome": "synthetic-interruption",
  "source_sha": "bbbbbbbbbbbbbbbbbbbbbbbbbbbbbbbbbbbbbbbb",
  "artifact": {
    "source_sha": "dddddddddddddddddddddddddddddddddddddddd",
    "image_id": "sha256:aaaaaaaaaaaaaaaaaaaaaaaaaaaaaaaaaaaaaaaaaaaaaaaaaaaaaaaaaaaaaaaa",
    "digest": "unavailable-local-build"
  },
  "config_contract_sha256": "cccccccccccccccccccccccccccccccccccccccccccccccccccccccccccccccc",
  "revisions": {
    "previous": "dddddddddddddddddddddddddddddddddddddddd",
    "current": {
      "kind": "restored"
    }
  },
  "backup": {
    "encrypted_sha256": "eeeeeeeeeeeeeeeeeeeeeeeeeeeeeeeeeeeeeeeeeeeeeeeeeeeeeeeeeeeeeeee",
    "isolated_restore": {
      "status": "verified",
      "mode": "isolated-ephemeral-postgres",
      "cleanup": "verified"
    }
  },
  "checks": {
    "health": "verified",
    "worker": "verified",
    "smoke": "verified"
  },
  "actions": {
    "ci": {
      "run_id": "101",
      "workflow": ".github/workflows/early-birds-fast-forward.yml",
      "attempt": 2,
      "head_sha": "bbbbbbbbbbbbbbbbbbbbbbbbbbbbbbbbbbbbbbbb"
    },
    "delivery": {
      "run_id": "202",
      "workflow": ".github/workflows/account-delivery.yml",
      "attempt": 3,
      "head_sha": "bbbbbbbbbbbbbbbbbbbbbbbbbbbbbbbbbbbbbbbb",
      "target": "staging",
      "operation": "interruption-checkpoint",
      "ci_run_id": "101",
      "ci_attempt": 2,
      "config_contract_sha256": "cccccccccccccccccccccccccccccccccccccccccccccccccccccccccccccccc"
    }
  },
  "rollback": {
    "result": "verified",
    "revision": "previous"
  },
  "interruption": {
    "checkpoint": "after-cutover",
    "expected_failure_observed": true,
    "synthetic_inputs": true,
    "cleanup": "verified"
  }
}
